<!ELEMENT SEQN (modified*, name, COT_info*, COT_slot*, COT_AEC*, COT_ROI*, COT_CMP* ,(SEQN_ENTRY, (SEQN_ENTRY, (SEQN_ENTRY, (SEQN_ENTRY, (SEQN_ENTRY, (SEQN_ENTRY, (SEQN_ENTRY, (SEQN_ENTRY)?)?)?)?)?)?)?)?)>

<!ELEMENT COT_AEC (#PCDATA)>

<!ELEMENT COT_ROI (#PCDATA)>

<!ELEMENT COT_CMP (#PCDATA)>

<!ELEMENT SEQN_ENTRY (PARM_NO, COT_PARM*, REGN_NO, COMP_CODE, AEC_NO,
BUF_NO, DMF, SEQN_INT)>
<!ATTLIST SEQN_ENTRY
	POS (1 | 2 | 3 | 4 | 5 | 6 | 7 | 8) #IMPLIED
>

<!ELEMENT PARM_NO (#PCDATA)>
<!ELEMENT COT_PARM (#PCDATA)>
<!ELEMENT REGN_NO (#PCDATA)>
<!ELEMENT COMP_CODE (#PCDATA)>
<!ELEMENT AEC_NO (#PCDATA)>
<!ELEMENT BUF_NO (#PCDATA)>
<!ELEMENT DMF (#PCDATA)>
<!ELEMENT SEQN_INT (#PCDATA)>

<!ELEMENT modified (#PCDATA)>
<!ATTLIST modified
	author CDATA #IMPLIED
	dateTime CDATA #IMPLIED
>

<!ELEMENT name (#PCDATA)>

<!ELEMENT COT_info (#PCDATA)>
<!ATTLIST COT_info
    deleted CDATA #IMPLIED
    lastUsed CDATA #IMPLIED
    version CDATA #IMPLIED
>
<!ELEMENT COT_slot (#PCDATA)>
