<?xml version="1.0" encoding="UTF-8"?>
<!-- Edited with XRT Chief Observer Tool version 2.0x40 (2080) -->
<!DOCTYPE SEQN SYSTEM "XRTSEQ.dtd">
<SEQN>
  <modified author="MCKENZIE, David" dateTime="2012-07-04T04:49:43Z" />
  <name>Ti/Poly (Thick Al) - 512FOV - 24s cad - AEC3 - 1064 1048 - With 384PFB</name>
  <COT_info deleted="FALSE" lastUsed="2012-07-04T04:27:43Z" version="2BD4" locked="FALSE"
    tag="E61837C93765/2BD4" COTversion="2.0x40" COTbuild="2080" Mutable="TRUE" />
  <COT_slot>-1</COT_slot>
  <COT_AEC>NOT USED</COT_AEC>
  <COT_ROI>NOT USED</COT_ROI>
  <COT_CMP>NOT USED</COT_CMP>
  <SEQN_ENTRY POS="1">
    <PARM_NO>2</PARM_NO>
    <COT_PARM>000009C67372/353A</COT_PARM>
    <REGN_NO>10</REGN_NO>
    <COT_fov FOV_type="normal" hcenter="1064" vcenter="1048" width="512" height="512" />
    <COMP_CODE>0x72c</COMP_CODE>
    <AEC_NO>3</AEC_NO>
    <BUF_NO>0</BUF_NO>
    <DMF>0</DMF>
    <SEQN_INT>12</SEQN_INT>
  </SEQN_ENTRY>
  <SEQN_ENTRY POS="2">
    <PARM_NO>2</PARM_NO>
    <COT_PARM>000009C67372/353A</COT_PARM>
    <REGN_NO>5</REGN_NO>
    <COT_fov FOV_type="preflare" hcenter="1064" vcenter="1048" width="384" height="384" />
    <COMP_CODE>0x72c</COMP_CODE>
    <AEC_NO>3</AEC_NO>
    <BUF_NO>1</BUF_NO>
    <DMF>0</DMF>
    <SEQN_INT>12</SEQN_INT>
  </SEQN_ENTRY>
  <SEQN_ENTRY POS="3">
    <PARM_NO>2</PARM_NO>
    <COT_PARM>000009C67372/353A</COT_PARM>
    <REGN_NO>5</REGN_NO>
    <COT_fov FOV_type="preflare" hcenter="1064" vcenter="1048" width="384" height="384" />
    <COMP_CODE>0x72c</COMP_CODE>
    <AEC_NO>3</AEC_NO>
    <BUF_NO>2</BUF_NO>
    <DMF>0</DMF>
    <SEQN_INT>12</SEQN_INT>
  </SEQN_ENTRY>
  <SEQN_ENTRY POS="4">
    <PARM_NO>2</PARM_NO>
    <COT_PARM>000009C67372/353A</COT_PARM>
    <REGN_NO>5</REGN_NO>
    <COT_fov FOV_type="preflare" hcenter="1064" vcenter="1048" width="384" height="384" />
    <COMP_CODE>0x72c</COMP_CODE>
    <AEC_NO>3</AEC_NO>
    <BUF_NO>3</BUF_NO>
    <DMF>0</DMF>
    <SEQN_INT>12</SEQN_INT>
  </SEQN_ENTRY>
</SEQN>
