<?xml version="1.0" encoding="UTF-8"?>
<!-- Edited with XRT Chief Observer Tool version 2.0x40 (2080) -->
<!DOCTYPE SEQN SYSTEM "XRTSEQ.dtd">
<SEQN>
  <modified author="TESTA, Paola" dateTime="2011-03-10T02:47:49Z" />
  <name>G-band and Dark (2sec) - 512x512 - 1064 1048 - Q98</name>
  <COT_info deleted="FALSE" lastUsed="2011-03-10T02:45:49Z" version="2B29" locked="FALSE"
    tag="1EAF29CC3569/2B29" COTversion="2.0x40" COTbuild="2080" Mutable="TRUE" />
  <COT_slot>-1</COT_slot>
  <COT_AEC>NOT USED</COT_AEC>
  <COT_ROI>NOT USED</COT_ROI>
  <COT_CMP>NOT USED</COT_CMP>
  <SEQN_ENTRY POS="1">
    <PARM_NO>67</PARM_NO>
    <COT_PARM>B00462C8EC2B/37C0</COT_PARM>
    <REGN_NO>7</REGN_NO>
    <COT_fov FOV_type="normal" hcenter="1064" vcenter="1048" width="512" height="512" />
    <COMP_CODE>0x728</COMP_CODE>
    <AEC_NO>0</AEC_NO>
    <BUF_NO>0</BUF_NO>
    <DMF>0</DMF>
    <SEQN_INT>4</SEQN_INT>
  </SEQN_ENTRY>
  <SEQN_ENTRY POS="2">
    <PARM_NO>3</PARM_NO>
    <COT_PARM>00007CE10EC0/3605</COT_PARM>
    <REGN_NO>7</REGN_NO>
    <COT_fov FOV_type="normal" hcenter="1064" vcenter="1048" width="512" height="512" />
    <COMP_CODE>0x728</COMP_CODE>
    <AEC_NO>0</AEC_NO>
    <BUF_NO>0</BUF_NO>
    <DMF>0</DMF>
    <SEQN_INT>4</SEQN_INT>
  </SEQN_ENTRY>
</SEQN>
