<?xml version="1.0" encoding="UTF-8"?>
<!-- Edited with XRT Chief Observer Tool version 2.0x39 (2080) -->
<!DOCTYPE SEQN SYSTEM "XRTSEQ.dtd">
<SEQN>
  <modified author="TAKEDA, Aki" dateTime="2017-07-21T20:32:15Z" />
  <name>Al/mesh 2897 ms and G-band 1 ms - 384x384 - 1x1 - AEC0 - Q95 - at Center</name>
  <COT_info deleted="FALSE" lastUsed="2023-05-06T02:05:39Z" version="2E43" locked="FALSE"
    tag="206220E1D324/2E43" COTversion="2.0x39" COTbuild="2080" Mutable="TRUE" />
  <COT_slot>49</COT_slot>
  <COT_AEC>NOT USED</COT_AEC>
  <COT_ROI>NOT USED</COT_ROI>
  <COT_CMP>NOT USED</COT_CMP>
  <SEQN_ENTRY POS="1">
    <PARM_NO>59</PARM_NO>
    <COT_PARM>1BCC740212E1/3769</COT_PARM>
    <REGN_NO>11</REGN_NO>
    <COT_fov FOV_type="normal" hcenter="1024" vcenter="1024" width="384" height="384" />
    <COMP_CODE>0x72c</COMP_CODE>
    <AEC_NO>0</AEC_NO>
    <BUF_NO>0</BUF_NO>
    <DMF>0</DMF>
    <SEQN_INT>4</SEQN_INT>
  </SEQN_ENTRY>
  <SEQN_ENTRY POS="2">
    <PARM_NO>39</PARM_NO>
    <COT_PARM>A2AD16059148/3940</COT_PARM>
    <REGN_NO>13</REGN_NO>
    <COT_fov FOV_type="normal" hcenter="1024" vcenter="1200" width="384" height="384" />
    <COMP_CODE>0x72c</COMP_CODE>
    <AEC_NO>0</AEC_NO>
    <BUF_NO>0</BUF_NO>
    <DMF>0</DMF>
    <SEQN_INT>4</SEQN_INT>
  </SEQN_ENTRY>
</SEQN>
