<?xml version="1.0" encoding="UTF-8"?>
<!-- Edited with XRT Chief Observer Tool version 2.0x40 (2080) -->
<!DOCTYPE SEQN SYSTEM "XRTSEQ.dtd">
<SEQN>
  <modified author="YOSHIMURA, Keiji" dateTime="2012-11-21T06:04:50Z" />
  <name>Thin-Be 2048 FOV, Q98, 2x2, Short and Long (256/5795)</name>
  <COT_info deleted="FALSE" lastUsed="2012-11-21T09:16:04Z" version="2C2B" locked="FALSE"
    tag="CBD10FC875FA/2C2B" COTversion="2.0x40" COTbuild="2080" Mutable="TRUE" />
  <COT_slot>-1</COT_slot>
  <COT_AEC>NOT USED</COT_AEC>
  <COT_ROI>NOT USED</COT_ROI>
  <COT_CMP>NOT USED</COT_CMP>
  <SEQN_ENTRY POS="1">
    <PARM_NO>47</PARM_NO>
    <COT_PARM>8B7B6DE3E75E/371F</COT_PARM>
    <REGN_NO>8</REGN_NO>
    <COT_fov FOV_type="normal" hcenter="1024" vcenter="1024" width="2048" height="2048" />
    <COMP_CODE>0x728</COMP_CODE>
    <AEC_NO>0</AEC_NO>
    <BUF_NO>0</BUF_NO>
    <DMF>0</DMF>
    <SEQN_INT>4</SEQN_INT>
  </SEQN_ENTRY>
  <SEQN_ENTRY POS="2">
    <PARM_NO>94</PARM_NO>
    <COT_PARM>B0F544CE8126/3720</COT_PARM>
    <REGN_NO>8</REGN_NO>
    <COT_fov FOV_type="normal" hcenter="1024" vcenter="1024" width="2048" height="2048" />
    <COMP_CODE>0x728</COMP_CODE>
    <AEC_NO>0</AEC_NO>
    <BUF_NO>0</BUF_NO>
    <DMF>0</DMF>
    <SEQN_INT>4</SEQN_INT>
  </SEQN_ENTRY>
</SEQN>
