<?xml version="1.0" encoding="UTF-8"?>
<!-- Edited with XRT Chief Observer Tool version 2.0x40 (2080) -->
<!DOCTYPE SEQN SYSTEM "XRTSEQ.dtd">
<SEQN>
  <modified author="BANDO, Takamasa" dateTime="2010-01-11T07:17:52Z" />
  <name>Synoptic Q98 2x2 4x4 8x8 1x1 Dark cal - Ti/poly 512ms</name>
  <COT_info deleted="FALSE" lastUsed="2012-05-15T01:56:55Z" version="29EE" locked="FALSE"
    tag="A6F96C19DB16/29EE" COTversion="2.0x40" COTbuild="2080" Mutable="TRUE" />
  <COT_slot>-1</COT_slot>
  <COT_AEC>NOT USED</COT_AEC>
  <COT_ROI>NOT USED</COT_ROI>
  <COT_CMP>NOT USED</COT_CMP>
  <SEQN_ENTRY POS="1">
    <PARM_NO>23</PARM_NO>
    <COT_PARM>1AA46D2A3A80/37BE</COT_PARM>
    <REGN_NO>10</REGN_NO>
    <COT_fov FOV_type="normal" hcenter="1024" vcenter="1024" width="2048" height="2048" />
    <COMP_CODE>0x728</COMP_CODE>
    <AEC_NO>0</AEC_NO>
    <BUF_NO>0</BUF_NO>
    <DMF>0</DMF>
    <SEQN_INT>4</SEQN_INT>
  </SEQN_ENTRY>
  <SEQN_ENTRY POS="2">
    <PARM_NO>24</PARM_NO>
    <COT_PARM>A5774694FE64/37C6</COT_PARM>
    <REGN_NO>10</REGN_NO>
    <COT_fov FOV_type="normal" hcenter="1024" vcenter="1024" width="2048" height="2048" />
    <COMP_CODE>0x728</COMP_CODE>
    <AEC_NO>0</AEC_NO>
    <BUF_NO>0</BUF_NO>
    <DMF>0</DMF>
    <SEQN_INT>4</SEQN_INT>
  </SEQN_ENTRY>
  <SEQN_ENTRY POS="3">
    <PARM_NO>25</PARM_NO>
    <COT_PARM>263D38411AED/37C7</COT_PARM>
    <REGN_NO>10</REGN_NO>
    <COT_fov FOV_type="normal" hcenter="1024" vcenter="1024" width="2048" height="2048" />
    <COMP_CODE>0x728</COMP_CODE>
    <AEC_NO>0</AEC_NO>
    <BUF_NO>0</BUF_NO>
    <DMF>0</DMF>
    <SEQN_INT>4</SEQN_INT>
  </SEQN_ENTRY>
</SEQN>
