<?xml version="1.0" encoding="UTF-8"?>
<!-- Edited with XRT Chief Observer Tool version 2.0x40 (2080) -->
<!DOCTYPE SEQN SYSTEM "XRTSEQ.dtd">
<SEQN>
  <modified author="NISHIDA, Keisuke" dateTime="2016-02-22T03:42:52Z" />
  <name>Synoptic Q98 2x2 Med-Al short(4096ms)/long(32768ms) set</name>
  <COT_info deleted="FALSE" lastUsed="2017-01-16T15:01:14Z" version="2DC0" locked="FALSE"
    tag="FCFD3D59C200/2DC0" COTversion="2.0x40" COTbuild="2080" Mutable="TRUE" />
  <COT_slot>-1</COT_slot>
  <COT_AEC>NOT USED</COT_AEC>
  <COT_ROI>NOT USED</COT_ROI>
  <COT_CMP>NOT USED</COT_CMP>
  <SEQN_ENTRY POS="1">
    <PARM_NO>99</PARM_NO>
    <COT_PARM>00006A1C853E/3585</COT_PARM>
    <REGN_NO>7</REGN_NO>
    <COT_fov FOV_type="normal" hcenter="1024" vcenter="1024" width="2048" height="2048" />
    <COMP_CODE>0x728</COMP_CODE>
    <AEC_NO>0</AEC_NO>
    <BUF_NO>0</BUF_NO>
    <DMF>0</DMF>
    <SEQN_INT>4</SEQN_INT>
  </SEQN_ENTRY>
  <SEQN_ENTRY POS="2">
    <PARM_NO>38</PARM_NO>
    <COT_PARM>9FFF0E06E382/38A7</COT_PARM>
    <REGN_NO>7</REGN_NO>
    <COT_fov FOV_type="normal" hcenter="1024" vcenter="1024" width="2048" height="2048" />
    <COMP_CODE>0x728</COMP_CODE>
    <AEC_NO>0</AEC_NO>
    <BUF_NO>0</BUF_NO>
    <DMF>0</DMF>
    <SEQN_INT>4</SEQN_INT>
  </SEQN_ENTRY>
</SEQN>
