<?xml version="1.0" encoding="UTF-8"?>
<!-- Edited with XRT Chief Observer Tool version 2.0x40 (2080) -->
<!DOCTYPE SEQN SYSTEM "XRTSEQ.dtd">
<SEQN>
  <modified author="TESTA, Paola" dateTime="2011-03-10T02:43:20Z" />
  <name>Ti/poly (Thick-Al), thin-Be (med-Be) shorter exp, Al/Poly (Med-Be) - 512FOV - AEC3 - 1064 1048 for normal AR</name>
  <COT_info deleted="FALSE" lastUsed="2011-04-20T09:12:23Z" version="2B28" locked="FALSE"
    tag="ECBE2463E6A3/2B28" COTversion="2.0x40" COTbuild="2080" Mutable="TRUE" />
  <COT_slot>-1</COT_slot>
  <COT_AEC>NOT USED</COT_AEC>
  <COT_ROI>NOT USED</COT_ROI>
  <COT_CMP>NOT USED</COT_CMP>
  <SEQN_ENTRY POS="1">
    <PARM_NO>2</PARM_NO>
    <COT_PARM>000012DA2A1B/352F</COT_PARM>
    <REGN_NO>7</REGN_NO>
    <COT_fov FOV_type="normal" hcenter="1064" vcenter="1048" width="512" height="512" />
    <COMP_CODE>0x72c</COMP_CODE>
    <AEC_NO>3</AEC_NO>
    <BUF_NO>0</BUF_NO>
    <DMF>0</DMF>
    <SEQN_INT>4</SEQN_INT>
  </SEQN_ENTRY>
  <SEQN_ENTRY POS="2">
    <PARM_NO>64</PARM_NO>
    <COT_PARM>42743B6367A2/3872</COT_PARM>
    <REGN_NO>7</REGN_NO>
    <COT_fov FOV_type="normal" hcenter="1064" vcenter="1048" width="512" height="512" />
    <COMP_CODE>0x72c</COMP_CODE>
    <AEC_NO>3</AEC_NO>
    <BUF_NO>0</BUF_NO>
    <DMF>0</DMF>
    <SEQN_INT>4</SEQN_INT>
  </SEQN_ENTRY>
  <SEQN_ENTRY POS="3">
    <PARM_NO>45</PARM_NO>
    <COT_PARM>00003029D24A/358B</COT_PARM>
    <REGN_NO>7</REGN_NO>
    <COT_fov FOV_type="normal" hcenter="1064" vcenter="1048" width="512" height="512" />
    <COMP_CODE>0x72c</COMP_CODE>
    <AEC_NO>3</AEC_NO>
    <BUF_NO>0</BUF_NO>
    <DMF>0</DMF>
    <SEQN_INT>4</SEQN_INT>
  </SEQN_ENTRY>
</SEQN>
