<?xml version="1.0" encoding="UTF-8"?>
<!-- Edited with XRT Chief Observer Tool version 2.0x40 (2080) -->
<!DOCTYPE SEQN SYSTEM "XRTSEQ.dtd">
<SEQN>
  <modified author="KOBELSKI, Adam" dateTime="2013-08-19T01:13:58Z" />
  <name>Synoptic Q95 2x2 Thin-Be short(128ms)/med(723ms)/long(3897ms)</name>
  <COT_info deleted="FALSE" lastUsed="2013-11-02T03:15:46Z" version="2C75" locked="FALSE"
    tag="EDAC556C7383/2C75" COTversion="2.0x40" COTbuild="2080" Mutable="TRUE" />
  <COT_slot>-1</COT_slot>
  <COT_AEC>NOT USED</COT_AEC>
  <COT_ROI>NOT USED</COT_ROI>
  <COT_CMP>NOT USED</COT_CMP>
  <SEQN_ENTRY POS="1">
    <PARM_NO>16</PARM_NO>
    <COT_PARM>C46863026722/3883</COT_PARM>
    <REGN_NO>8</REGN_NO>
    <COT_fov FOV_type="normal" hcenter="1024" vcenter="1024" width="2048" height="2048" />
    <COMP_CODE>0x72c</COMP_CODE>
    <AEC_NO>0</AEC_NO>
    <BUF_NO>0</BUF_NO>
    <DMF>0</DMF>
    <SEQN_INT>4</SEQN_INT>
  </SEQN_ENTRY>
  <SEQN_ENTRY POS="2">
    <PARM_NO>47</PARM_NO>
    <COT_PARM>7BBF31D50850/38CA</COT_PARM>
    <REGN_NO>8</REGN_NO>
    <COT_fov FOV_type="normal" hcenter="1024" vcenter="1024" width="2048" height="2048" />
    <COMP_CODE>0x72c</COMP_CODE>
    <AEC_NO>0</AEC_NO>
    <BUF_NO>0</BUF_NO>
    <DMF>0</DMF>
    <SEQN_INT>4</SEQN_INT>
  </SEQN_ENTRY>
  <SEQN_ENTRY POS="3">
    <PARM_NO>59</PARM_NO>
    <COT_PARM>F08E630A2A13/38CB</COT_PARM>
    <REGN_NO>8</REGN_NO>
    <COT_fov FOV_type="normal" hcenter="1024" vcenter="1024" width="2048" height="2048" />
    <COMP_CODE>0x72c</COMP_CODE>
    <AEC_NO>0</AEC_NO>
    <BUF_NO>0</BUF_NO>
    <DMF>0</DMF>
    <SEQN_INT>4</SEQN_INT>
  </SEQN_ENTRY>
</SEQN>
