<?xml version="1.0" encoding="UTF-8"?>
<!-- Edited with XRT Chief Observer Tool version 2.0x40 (2080) -->
<!DOCTYPE SEQN SYSTEM "XRTSEQ.dtd">
<SEQN>
  <modified author="REEVES, Kathy" dateTime="2021-07-23T19:50:18Z" />
  <name>Flare - multifilter (Be/thin, Be/med) - 384x384 - AEC1 - 8/256 - Be/med, Al/thick</name>
  <COT_info deleted="FALSE" lastUsed="2022-05-12T02:04:39Z" version="2EB9" locked="FALSE"
    tag="251356D48A91/2EB9" COTversion="2.0x40" COTbuild="2080" Mutable="TRUE" />
  <COT_slot>-1</COT_slot>
  <COT_AEC>NOT USED</COT_AEC>
  <COT_ROI>NOT USED</COT_ROI>
  <COT_CMP>NOT USED</COT_CMP>
  <SEQN_ENTRY POS="1">
    <PARM_NO>34</PARM_NO>
    <COT_PARM>F83561ED061E/367E</COT_PARM>
    <REGN_NO>15</REGN_NO>
    <COT_fov FOV_type="flare1" hcenter="1024" vcenter="1024" width="384" height="384" />
    <COMP_CODE>0x72c</COMP_CODE>
    <AEC_NO>1</AEC_NO>
    <BUF_NO>0</BUF_NO>
    <DMF>0</DMF>
    <SEQN_INT>4</SEQN_INT>
  </SEQN_ENTRY>
  <SEQN_ENTRY POS="2">
    <PARM_NO>5</PARM_NO>
    <COT_PARM>D574788F0BF5/3664</COT_PARM>
    <REGN_NO>15</REGN_NO>
    <COT_fov FOV_type="flare1" hcenter="1024" vcenter="1024" width="384" height="384" />
    <COMP_CODE>0x72c</COMP_CODE>
    <AEC_NO>1</AEC_NO>
    <BUF_NO>0</BUF_NO>
    <DMF>0</DMF>
    <SEQN_INT>4</SEQN_INT>
  </SEQN_ENTRY>
</SEQN>
