<?xml version="1.0" encoding="UTF-8"?>
<!-- Edited with XRT Chief Observer Tool version 2.0x40 (2080) -->
<!DOCTYPE SEQN SYSTEM "XRTSEQ.dtd">
<SEQN>
  <modified author="SAVCHEVA, Antonia" dateTime="2010-06-04T19:39:20Z" />
  <name>Al/Mesh(Ti/Poly)-256FOV-10s cadence-AEC3-3</name>
  <COT_info deleted="FALSE" lastUsed="2010-06-04T19:37:35Z" version="2A52" locked="FALSE"
    tag="3F3F78A2B3BF/2A52" COTversion="2.0x40" COTbuild="2080" Mutable="TRUE" />
  <COT_slot>-1</COT_slot>
  <COT_AEC>NOT USED</COT_AEC>
  <COT_ROI>NOT USED</COT_ROI>
  <COT_CMP>NOT USED</COT_CMP>
  <SEQN_ENTRY POS="1">
    <PARM_NO>1</PARM_NO>
    <COT_PARM>0000085844B6/360E</COT_PARM>
    <REGN_NO>12</REGN_NO>
    <COT_fov FOV_type="normal" hcenter="1024" vcenter="1024" width="256" height="256" />
    <COMP_CODE>0x328</COMP_CODE>
    <AEC_NO>3</AEC_NO>
    <BUF_NO>0</BUF_NO>
    <DMF>0</DMF>
    <SEQN_INT>20</SEQN_INT>
  </SEQN_ENTRY>
</SEQN>
