<?xml version="1.0" encoding="UTF-8"?>
<!-- Edited with XRT Chief Observer Tool version 2.0x40 (2080) -->
<!DOCTYPE SEQN SYSTEM "XRTSEQ.dtd">
<SEQN>
  <modified author="KOBELSKI, Adam" dateTime="2013-08-16T05:39:41Z" />
  <name>HOP128-Al/Mesh-1x1-512x512-AEC3-Thin_be (PFB) - Q95-at_1064</name>
  <COT_info deleted="FALSE" lastUsed="2013-08-17T01:57:48Z" version="2C76" locked="FALSE"
    tag="7A6D776CFDC2/2C76" COTversion="2.0x40" COTbuild="2080" Mutable="TRUE" />
  <COT_slot>-1</COT_slot>
  <COT_AEC>NOT USED</COT_AEC>
  <COT_ROI>NOT USED</COT_ROI>
  <COT_CMP>NOT USED</COT_CMP>
  <SEQN_ENTRY POS="1">
    <PARM_NO>80</PARM_NO>
    <COT_PARM>B80B7C5245BC/3743</COT_PARM>
    <REGN_NO>7</REGN_NO>
    <COT_fov FOV_type="normal" hcenter="1064" vcenter="1048" width="512" height="512" />
    <COMP_CODE>0x72c</COMP_CODE>
    <AEC_NO>3</AEC_NO>
    <BUF_NO>0</BUF_NO>
    <DMF>0</DMF>
    <SEQN_INT>4</SEQN_INT>
  </SEQN_ENTRY>
  <SEQN_ENTRY POS="2">
    <PARM_NO>4</PARM_NO>
    <COT_PARM>000074C1DE18/353C</COT_PARM>
    <REGN_NO>5</REGN_NO>
    <COT_fov FOV_type="preflare" hcenter="1064" vcenter="1048" width="384" height="384" />
    <COMP_CODE>0x72c</COMP_CODE>
    <AEC_NO>3</AEC_NO>
    <BUF_NO>1</BUF_NO>
    <DMF>0</DMF>
    <SEQN_INT>4</SEQN_INT>
  </SEQN_ENTRY>
  <SEQN_ENTRY POS="3">
    <PARM_NO>4</PARM_NO>
    <COT_PARM>000074C1DE18/353C</COT_PARM>
    <REGN_NO>5</REGN_NO>
    <COT_fov FOV_type="preflare" hcenter="1064" vcenter="1048" width="384" height="384" />
    <COMP_CODE>0x72c</COMP_CODE>
    <AEC_NO>3</AEC_NO>
    <BUF_NO>2</BUF_NO>
    <DMF>0</DMF>
    <SEQN_INT>4</SEQN_INT>
  </SEQN_ENTRY>
  <SEQN_ENTRY POS="4">
    <PARM_NO>4</PARM_NO>
    <COT_PARM>000074C1DE18/353C</COT_PARM>
    <REGN_NO>5</REGN_NO>
    <COT_fov FOV_type="preflare" hcenter="1064" vcenter="1048" width="384" height="384" />
    <COMP_CODE>0x72c</COMP_CODE>
    <AEC_NO>3</AEC_NO>
    <BUF_NO>3</BUF_NO>
    <DMF>0</DMF>
    <SEQN_INT>4</SEQN_INT>
  </SEQN_ENTRY>
</SEQN>
