<?xml version="1.0" encoding="UTF-8"?>
<!-- Edited with XRT Chief Observer Tool version 2.0x40 (2080) -->
<!DOCTYPE SEQN SYSTEM "XRTSEQ.dtd">
<SEQN>
  <modified author="YOSHIMURA, Keiji" dateTime="2012-11-19T06:58:05Z" />
  <name>G-Band Test - 33ms - VLS closed - 1x1 - 2048FOV- DPCM</name>
  <COT_info deleted="FALSE" lastUsed="2015-06-02T03:15:28Z" version="2BD3" locked="FALSE"
    tag="C04F10E44521/2BD3" COTversion="2.0x40" COTbuild="2080" Mutable="TRUE" />
  <COT_slot>-1</COT_slot>
  <COT_AEC>NOT USED</COT_AEC>
  <COT_ROI>NOT USED</COT_ROI>
  <COT_CMP>NOT USED</COT_CMP>
  <SEQN_ENTRY POS="1">
    <PARM_NO>37</PARM_NO>
    <COT_PARM>1B2A2D5A6297/3895</COT_PARM>
    <REGN_NO>6</REGN_NO>
    <COT_fov FOV_type="normal" hcenter="1024" vcenter="1024" width="2048" height="2048" />
    <COMP_CODE>0x328</COMP_CODE>
    <AEC_NO>0</AEC_NO>
    <BUF_NO>0</BUF_NO>
    <DMF>0</DMF>
    <SEQN_INT>4</SEQN_INT>
  </SEQN_ENTRY>
</SEQN>
