<?xml version="1.0" encoding="UTF-8"?>
<!-- Edited with XRT Chief Observer Tool version 2.0x40 (2080) -->
<!DOCTYPE SEQN SYSTEM "XRTSEQ.dtd">
<SEQN>
  <modified author="SHIMOJO, Masumi" dateTime="2008-02-28T03:34:42Z" />
  <name>XBP Al/poly (AEC1) - FOV384x512</name>
  <COT_info deleted="FALSE" lastUsed="2007-11-24T02:32:54Z" version="25E5" locked="FALSE"
    tag="0F8A4B779A34/25E5" COTversion="2.0x40" COTbuild="2080" Mutable="TRUE" />
  <COT_slot>-1</COT_slot>
  <COT_AEC>NOT USED</COT_AEC>
  <COT_ROI>NOT USED</COT_ROI>
  <COT_CMP>NOT USED</COT_CMP>
  <SEQN_ENTRY POS="1">
    <PARM_NO>18</PARM_NO>
    <COT_PARM>00004B0B31D2/3640</COT_PARM>
    <REGN_NO>10</REGN_NO>
    <COT_fov FOV_type="normal" hcenter="1024" vcenter="1024" width="384" height="512" />
    <COMP_CODE>0x328</COMP_CODE>
    <AEC_NO>1</AEC_NO>
    <BUF_NO>0</BUF_NO>
    <DMF>0</DMF>
    <SEQN_INT>4</SEQN_INT>
  </SEQN_ENTRY>
</SEQN>
