<?xml version="1.0" encoding="UTF-8"?>
<!-- Edited with XRT Chief Observer Tool version 2.0x40 (2080) -->
<!DOCTYPE SEQN SYSTEM "XRTSEQ.dtd">
<SEQN>
  <modified author="SCHANCHE, Nicole" dateTime="2014-07-23T15:34:03Z" />
  <name>Thin-Be (Med-Be) - 384FOV - AEC3 - 1064 1048 - no PFB - 10s-cad</name>
  <COT_info deleted="FALSE" lastUsed="2016-09-24T03:00:58Z" version="2CB9" locked="FALSE"
    tag="59A021758E1C/2CB9" COTversion="2.0x40" COTbuild="2080" Mutable="TRUE" />
  <COT_slot>-1</COT_slot>
  <COT_AEC>NOT USED</COT_AEC>
  <COT_ROI>NOT USED</COT_ROI>
  <COT_CMP>NOT USED</COT_CMP>
  <SEQN_ENTRY POS="1">
    <PARM_NO>58</PARM_NO>
    <COT_PARM>853E4A17E6F8/3676</COT_PARM>
    <REGN_NO>6</REGN_NO>
    <COT_fov FOV_type="normal" hcenter="1064" vcenter="1048" width="384" height="384" />
    <COMP_CODE>0x72c</COMP_CODE>
    <AEC_NO>3</AEC_NO>
    <BUF_NO>0</BUF_NO>
    <DMF>0</DMF>
    <SEQN_INT>20</SEQN_INT>
  </SEQN_ENTRY>
</SEQN>
