<?xml version="1.0" encoding="UTF-8"?>
<!-- Edited with XRT Chief Observer Tool version 2.0x40 (2080) -->
<!DOCTYPE SEQN SYSTEM "XRTSEQ.dtd">
<SEQN>
  <modified author="SHIMOJO, Masumi" dateTime="2008-02-28T03:34:42Z" />
  <name>G-Band Alignment - 1x1 - 512FOV - shifted</name>
  <COT_info deleted="FALSE" lastUsed="2007-05-05T08:43:17Z" version="2487" locked="FALSE"
    tag="51BC07410928/2487" COTversion="2.0x40" COTbuild="2080" Mutable="TRUE" />
  <COT_slot>-1</COT_slot>
  <COT_AEC>NOT USED</COT_AEC>
  <COT_ROI>NOT USED</COT_ROI>
  <COT_CMP>NOT USED</COT_CMP>
  <SEQN_ENTRY POS="1">
    <PARM_NO>14</PARM_NO>
    <COT_PARM>00007CE10EC0/3605</COT_PARM>
    <REGN_NO>7</REGN_NO>
    <COT_fov FOV_type="normal" hcenter="928" vcenter="976" width="512" height="512" />
    <COMP_CODE>0x728</COMP_CODE>
    <AEC_NO>0</AEC_NO>
    <BUF_NO>0</BUF_NO>
    <DMF>0</DMF>
    <SEQN_INT>4</SEQN_INT>
  </SEQN_ENTRY>
</SEQN>
