<?xml version="1.0" encoding="UTF-8"?>
<!-- Edited with XRT Chief Observer Tool version 2.0x40 (2080) -->
<!DOCTYPE SEQN SYSTEM "XRTSEQ.dtd">
<SEQN>
  <modified author="FARID, Samaiyah" dateTime="2011-10-25T02:13:36Z" />
  <name>Flare Obs. - Fale Safe Mode-no-thick-be</name>
  <COT_info deleted="FALSE" lastUsed="2011-10-26T20:19:00Z" version="2B8B" locked="FALSE"
    tag="0B6D0382F5F9/2B8B" COTversion="2.0x40" COTbuild="2080" Mutable="TRUE" />
  <COT_slot>-1</COT_slot>
  <COT_AEC>NOT USED</COT_AEC>
  <COT_ROI>NOT USED</COT_ROI>
  <COT_CMP>NOT USED</COT_CMP>
  <SEQN_ENTRY POS="1">
    <PARM_NO>77</PARM_NO>
    <COT_PARM>7E7C2C1961E1/3858</COT_PARM>
    <REGN_NO>15</REGN_NO>
    <COT_fov FOV_type="flare1" hcenter="1024" vcenter="1024" width="384" height="384" />
    <COMP_CODE>0x72c</COMP_CODE>
    <AEC_NO>1</AEC_NO>
    <BUF_NO>0</BUF_NO>
    <DMF>0</DMF>
    <SEQN_INT>4</SEQN_INT>
  </SEQN_ENTRY>
  <SEQN_ENTRY POS="2">
    <PARM_NO>62</PARM_NO>
    <COT_PARM>109C5008EBD7/3675</COT_PARM>
    <REGN_NO>15</REGN_NO>
    <COT_fov FOV_type="flare1" hcenter="1024" vcenter="1024" width="384" height="384" />
    <COMP_CODE>0x72c</COMP_CODE>
    <AEC_NO>1</AEC_NO>
    <BUF_NO>0</BUF_NO>
    <DMF>0</DMF>
    <SEQN_INT>4</SEQN_INT>
  </SEQN_ENTRY>
  <SEQN_ENTRY POS="3">
    <PARM_NO>3</PARM_NO>
    <COT_PARM>00007CE10EC0/3605</COT_PARM>
    <REGN_NO>15</REGN_NO>
    <COT_fov FOV_type="flare1" hcenter="1024" vcenter="1024" width="384" height="384" />
    <COMP_CODE>0x728</COMP_CODE>
    <AEC_NO>0</AEC_NO>
    <BUF_NO>0</BUF_NO>
    <DMF>0</DMF>
    <SEQN_INT>4</SEQN_INT>
  </SEQN_ENTRY>
  <SEQN_ENTRY POS="4">
    <PARM_NO>84</PARM_NO>
    <COT_PARM>17AD4139923F/36C1</COT_PARM>
    <REGN_NO>15</REGN_NO>
    <COT_fov FOV_type="flare1" hcenter="1024" vcenter="1024" width="384" height="384" />
    <COMP_CODE>0x728</COMP_CODE>
    <AEC_NO>0</AEC_NO>
    <BUF_NO>0</BUF_NO>
    <DMF>0</DMF>
    <SEQN_INT>4</SEQN_INT>
  </SEQN_ENTRY>
</SEQN>
