<?xml version="1.0" encoding="UTF-8"?>
<!-- Edited with XRT Chief Observer Tool version 2.0x40 (2080) -->
<!DOCTYPE SEQN SYSTEM "XRTSEQ.dtd">
<SEQN>
  <modified author="TESTA, Paola" dateTime="2008-06-24T01:08:36Z" />
  <name>Al/poly - DPCM 2x2 - 768x768 4s no_AEC-FOV offset</name>
  <COT_info deleted="FALSE" lastUsed="2011-01-08T01:20:47Z" version="2780" locked="FALSE"
    tag="E4DE47CC41CA/2780" COTversion="2.0x40" COTbuild="2080" Mutable="TRUE" />
  <COT_slot>-1</COT_slot>
  <COT_AEC>NOT USED</COT_AEC>
  <COT_ROI>NOT USED</COT_ROI>
  <COT_CMP>NOT USED</COT_CMP>
  <SEQN_ENTRY POS="1">
    <PARM_NO>33</PARM_NO>
    <COT_PARM>00005D5E8B29/3633</COT_PARM>
    <REGN_NO>11</REGN_NO>
    <COT_fov FOV_type="normal" hcenter="1152" vcenter="904" width="768" height="768" />
    <COMP_CODE>0x328</COMP_CODE>
    <AEC_NO>0</AEC_NO>
    <BUF_NO>0</BUF_NO>
    <DMF>0</DMF>
    <SEQN_INT>4</SEQN_INT>
  </SEQN_ENTRY>
</SEQN>
