<?xml version="1.0" encoding="UTF-8"?>
<!-- Edited with XRT Chief Observer Tool version 2.0x40 (2080) -->
<!DOCTYPE SEQN SYSTEM "XRTSEQ.dtd">
<SEQN>
  <modified author="PRCHLIK, Jakub" dateTime="2017-03-16T02:28:30Z" />
  <name>Polar Monitoring - Al/mesh (6s) and Al/poly (8s) - 384FOV - Q90</name>
  <COT_info deleted="FALSE" lastUsed="2020-06-01T17:58:20Z" version="2E01" locked="FALSE"
    tag="D73847D22120/2E01" COTversion="2.0x40" COTbuild="2080" Mutable="TRUE" />
  <COT_slot>-1</COT_slot>
  <COT_AEC>NOT USED</COT_AEC>
  <COT_ROI>NOT USED</COT_ROI>
  <COT_CMP>NOT USED</COT_CMP>
  <SEQN_ENTRY POS="1">
    <PARM_NO>92</PARM_NO>
    <COT_PARM>37F043942D0E/36B5</COT_PARM>
    <REGN_NO>11</REGN_NO>
    <COT_fov FOV_type="normal" hcenter="1064" vcenter="1048" width="384" height="384" />
    <COMP_CODE>0x729</COMP_CODE>
    <AEC_NO>0</AEC_NO>
    <BUF_NO>0</BUF_NO>
    <DMF>0</DMF>
    <SEQN_INT>4</SEQN_INT>
  </SEQN_ENTRY>
</SEQN>
