<?xml version="1.0" encoding="UTF-8"?>
<!-- Edited with XRT Chief Observer Tool version 2.0x40 (2080) -->
<!DOCTYPE SEQN SYSTEM "XRTSEQ.dtd">
<SEQN>
  <modified author="MINOSHIMA, Takashi" dateTime="2009-06-22T06:45:00Z" />
  <name>Al/mesh (12s), Al/poly (16s), Ti/poly (32s) - 384x384</name>
  <COT_info deleted="FALSE" lastUsed="2009-06-19T09:38:07Z" version="2923" locked="FALSE"
    tag="74A42A3EF54C/2923" COTversion="2.0x40" COTbuild="2080" Mutable="TRUE" />
  <COT_slot>-1</COT_slot>
  <COT_AEC>NOT USED</COT_AEC>
  <COT_ROI>NOT USED</COT_ROI>
  <COT_CMP>NOT USED</COT_CMP>
  <SEQN_ENTRY POS="1">
    <PARM_NO>58</PARM_NO>
    <COT_PARM>F2C953CF080D/36C6</COT_PARM>
    <REGN_NO>9</REGN_NO>
    <COT_fov FOV_type="normal" hcenter="1064" vcenter="1048" width="384" height="384" />
    <COMP_CODE>0x729</COMP_CODE>
    <AEC_NO>0</AEC_NO>
    <BUF_NO>0</BUF_NO>
    <DMF>0</DMF>
    <SEQN_INT>4</SEQN_INT>
  </SEQN_ENTRY>
  <SEQN_ENTRY POS="2">
    <PARM_NO>27</PARM_NO>
    <COT_PARM>00001AB99241/351E</COT_PARM>
    <REGN_NO>9</REGN_NO>
    <COT_fov FOV_type="normal" hcenter="1064" vcenter="1048" width="384" height="384" />
    <COMP_CODE>0x729</COMP_CODE>
    <AEC_NO>0</AEC_NO>
    <BUF_NO>0</BUF_NO>
    <DMF>0</DMF>
    <SEQN_INT>4</SEQN_INT>
  </SEQN_ENTRY>
  <SEQN_ENTRY POS="3">
    <PARM_NO>1</PARM_NO>
    <COT_PARM>00005FEF2422/351A</COT_PARM>
    <REGN_NO>10</REGN_NO>
    <COT_fov FOV_type="normal" hcenter="1064" vcenter="1048" width="384" height="384" />
    <COMP_CODE>0x729</COMP_CODE>
    <AEC_NO>0</AEC_NO>
    <BUF_NO>0</BUF_NO>
    <DMF>0</DMF>
    <SEQN_INT>4</SEQN_INT>
  </SEQN_ENTRY>
</SEQN>
