<?xml version="1.0" encoding="UTF-8"?>
<!-- Edited with XRT Chief Observer Tool version 2.0x40 (2080) -->
<!DOCTYPE SEQN SYSTEM "XRTSEQ.dtd">
<SEQN>
  <modified author="ISHIBASHI, Bish" dateTime="2013-11-01T07:18:47Z" />
  <name>Full Sun - Al/Poly - 4x4 - AEC2 - Active Sun</name>
  <COT_info deleted="FALSE" lastUsed="2014-05-01T04:01:28Z" version="2C96" locked="FALSE"
    tag="C97B6E953890/2C96" COTversion="2.0x40" COTbuild="2080" Mutable="TRUE" />
  <COT_slot>-1</COT_slot>
  <COT_AEC>NOT USED</COT_AEC>
  <COT_ROI>NOT USED</COT_ROI>
  <COT_CMP>NOT USED</COT_CMP>
  <SEQN_ENTRY POS="1">
    <PARM_NO>43</PARM_NO>
    <COT_PARM>021D36189771/38C0</COT_PARM>
    <REGN_NO>7</REGN_NO>
    <COT_fov FOV_type="normal" hcenter="1024" vcenter="1024" width="2048" height="2048" />
    <COMP_CODE>0x728</COMP_CODE>
    <AEC_NO>2</AEC_NO>
    <BUF_NO>0</BUF_NO>
    <DMF>0</DMF>
    <SEQN_INT>4</SEQN_INT>
  </SEQN_ENTRY>
</SEQN>
