<?xml version="1.0" encoding="UTF-8"?>
<!-- Edited with XRT Chief Observer Tool version 2.0x40 (2080) -->
<!DOCTYPE SEQN SYSTEM "XRTSEQ.dtd">
<SEQN>
  <modified author="MASUDA, Satoshi" dateTime="2008-03-21T11:05:43Z" />
  <name>CH (Al/poly) - 16s exp- FOV512-DARK Q90</name>
  <COT_info deleted="FALSE" lastUsed="2008-03-22T06:07:51Z" version="26EC" locked="FALSE"
    tag="9AE320AD45DA/26EC" COTversion="2.0x40" COTbuild="2080" Mutable="TRUE" />
  <COT_slot>-1</COT_slot>
  <COT_AEC>NOT USED</COT_AEC>
  <COT_ROI>NOT USED</COT_ROI>
  <COT_CMP>NOT USED</COT_CMP>
  <SEQN_ENTRY POS="1">
    <PARM_NO>81</PARM_NO>
    <COT_PARM>00001ADFD271/35E2</COT_PARM>
    <REGN_NO>6</REGN_NO>
    <COT_fov FOV_type="normal" hcenter="1024" vcenter="1024" width="512" height="512" />
    <COMP_CODE>0x729</COMP_CODE>
    <AEC_NO>0</AEC_NO>
    <BUF_NO>0</BUF_NO>
    <DMF>0</DMF>
    <SEQN_INT>4</SEQN_INT>
  </SEQN_ENTRY>
</SEQN>
