<?xml version="1.0" encoding="UTF-8"?>
<!-- Edited with XRT Chief Observer Tool version 2.0x40 (2080) -->
<!DOCTYPE SEQN SYSTEM "XRTSEQ.dtd">
<SEQN>
  <modified author="SAVCHEVA, Antonia" dateTime="2008-05-09T19:51:13Z" />
  <name>Al/mesh - 512, lossless 1x1, 2x2,4x4-AR</name>
  <COT_info deleted="FALSE" lastUsed="2008-05-08T16:24:53Z" version="2740" locked="FALSE"
    tag="323A1641F958/2740" COTversion="2.0x40" COTbuild="2080" Mutable="TRUE" />
  <COT_slot>-1</COT_slot>
  <COT_AEC>NOT USED</COT_AEC>
  <COT_ROI>NOT USED</COT_ROI>
  <COT_CMP>NOT USED</COT_CMP>
  <SEQN_ENTRY POS="1">
    <PARM_NO>1</PARM_NO>
    <COT_PARM>D800038C3828/375B</COT_PARM>
    <REGN_NO>1</REGN_NO>
    <COT_fov FOV_type="normal" hcenter="1024" vcenter="1024" width="512" height="512" />
    <COMP_CODE>0x328</COMP_CODE>
    <AEC_NO>0</AEC_NO>
    <BUF_NO>0</BUF_NO>
    <DMF>0</DMF>
    <SEQN_INT>4</SEQN_INT>
  </SEQN_ENTRY>
  <SEQN_ENTRY POS="2">
    <PARM_NO>1</PARM_NO>
    <COT_PARM>3FA2667A0E6B/375C</COT_PARM>
    <REGN_NO>1</REGN_NO>
    <COT_fov FOV_type="normal" hcenter="1024" vcenter="1024" width="512" height="512" />
    <COMP_CODE>0x328</COMP_CODE>
    <AEC_NO>0</AEC_NO>
    <BUF_NO>0</BUF_NO>
    <DMF>0</DMF>
    <SEQN_INT>4</SEQN_INT>
  </SEQN_ENTRY>
  <SEQN_ENTRY POS="3">
    <PARM_NO>1</PARM_NO>
    <COT_PARM>80072B968FBA/375D</COT_PARM>
    <REGN_NO>1</REGN_NO>
    <COT_fov FOV_type="normal" hcenter="1024" vcenter="1024" width="512" height="512" />
    <COMP_CODE>0x328</COMP_CODE>
    <AEC_NO>0</AEC_NO>
    <BUF_NO>0</BUF_NO>
    <DMF>0</DMF>
    <SEQN_INT>4</SEQN_INT>
  </SEQN_ENTRY>
</SEQN>
