<?xml version="1.0" encoding="UTF-8"?>
<!-- Edited with XRT Chief Observer Tool version 2.0x40 (2080) -->
<!DOCTYPE SEQN SYSTEM "XRTSEQ.dtd">
<SEQN>
  <modified author="SAVAGE, Sabrina" dateTime="2008-10-10T05:22:58Z" />
  <name>Al/poly 8192ms Dark - FOV384</name>
  <COT_info deleted="FALSE" lastUsed="2008-10-16T00:12:34Z" version="280B" locked="FALSE"
    tag="69006AAFE65D/280B" COTversion="2.0x40" COTbuild="2080" Mutable="TRUE" />
  <COT_slot>-1</COT_slot>
  <COT_AEC>NOT USED</COT_AEC>
  <COT_ROI>NOT USED</COT_ROI>
  <COT_CMP>NOT USED</COT_CMP>
  <SEQN_ENTRY POS="1">
    <PARM_NO>8</PARM_NO>
    <COT_PARM>00004A7186D2/3500</COT_PARM>
    <REGN_NO>13</REGN_NO>
    <COT_fov FOV_type="normal" hcenter="1024" vcenter="1024" width="384" height="384" />
    <COMP_CODE>0x328</COMP_CODE>
    <AEC_NO>0</AEC_NO>
    <BUF_NO>0</BUF_NO>
    <DMF>0</DMF>
    <SEQN_INT>4</SEQN_INT>
  </SEQN_ENTRY>
</SEQN>
